labels,dashboardlabels,factor,counts,percent,correlation,translation,total,obese
Alcohol cunsumption exceeded lifetime risk guidelines(n),Excessive alcohol cunsumption,alcohol,3092.1,17.44,-0.94,Strong negative correlation,"17,733.30","11,238.60"
Low daily fruit consumption,Low Daily fruit consumption,fruit,8904.4,50.21,0.49,Moderate positive correlation,"17,733.30","11,238.60"
Daily consumption of vegetables did not meet recommendation,Low daily vegetable consumption,vegatable,16478,92.92,-0.41,Moderate negative correlation,"17,733.30","11,238.60"
Daily smoker,Daily smoker,smoke,2573.8,14.51,-0.95,Strong negative correlation,"17,733.30","11,238.60"
Zero minutes of physical activity (ah),No physical activity,physical,3054.1,17.22,-0.77,Strong negative correlation,"17,733.30","11,238.60"