labels,dashboardlabels,factor,counts,percent,correlation,translation,total,obese
Alcohol cunsumption exceeded lifetime risk guidelines(n),Excessive alcohol cunsumption,alcohol,"3,001.00",16.08580526,-0.937565851,Strong negative correlation,"18,656.20","1,182.60"
Low daily fruit consumption,Low Daily fruit consumption,fruit,"9,080.50",48.67282726,0.487066627,Moderate positive correlation,"18,656.20","1,182.60"
Daily consumption of vegetables did not meet recommendation,Low daily vegetable consumption,vegatable,"17,247.40",92.44862298,-0.41411362,Moderate negative correlation,"18,656.20","1,182.60"
Daily smoker,Daily smoker,smoke,"2,567.00",13.75950086,-0.948204201,Strong negative correlation,"18,656.20","1,182.60"
Zero minutes of physical activity (ah),No physical activity,physical,"3,457.90",18.53485704,-0.765060874,Strong negative correlation,"18,656.20","1,182.60"